{
  "eir_schema_version": "0.1.0",
  "project": {"project_id": "prj_demo"},
  "revision": {"revision_id": "rev_tension_bar_001", "project_id": "prj_demo", "parent_revision_ids": [], "manifest_sha256": null},
  "geometry": [{"geometry_id": "geom_tension_bar", "artifact": {"uri": "artifacts/tension_bar.step", "sha256": null, "format": "STEP", "format_version": "AP242"}, "length_unit": "mm", "frame_id": "frame_tension_bar"}],
  "materials": [{"material_id": "steel_linear_elastic", "model": "linear_elastic_isotropic", "properties": {"young_modulus": {"value": 210000, "unit": "N/mm2"}, "poisson_ratio": {"value": 0.3, "unit": "1"}}}],
  "simulation_cases": [{
    "case_id": "case_tension_bar_v1", "revision_id": "rev_tension_bar_001", "domain": "structural", "analysis": "static_linear", "frame_id": "frame_tension_bar",
    "groups": ["VOLUME", "X_FIXED", "X_DISPLACED", "PIN_A", "PIN_B"], "group_manifest_ref": "artifact_group_manifest", "loads": [],
    "constraints": [
      {"group": "X_FIXED", "kind": "displacement", "components": {"x": {"value": 0, "unit": "mm"}}},
      {"group": "X_DISPLACED", "kind": "displacement", "components": {"x": {"value": 0.01, "unit": "mm"}}},
      {"selection_ref": "PIN_A", "kind": "displacement", "components": {"y": {"value": 0, "unit": "mm"}, "z": {"value": 0, "unit": "mm"}}},
      {"selection_ref": "PIN_B", "kind": "displacement", "components": {"z": {"value": 0, "unit": "mm"}}}
    ],
    "solver": {"adapter_id": "calculix.batch", "proposed_target_version": "2.23"}
  }]
}
